{"atu_version":"0.2.0","citation":{"dataset":null,"dataset_doi":null,"software_doi":null,"split":null},"episode":{"agent_profile":{"agent_name":"autogen-assistant","agent_role":null,"metadata":{},"persona":null},"episode_id":"atu-ep-b087508fbff90258d1","parent_episode_id":null,"task_context":{"constraints":[],"goal":"Find two synthetic sources and summarize them","policy_context":{},"task_type":"research"}},"execution":{"evidence_edges":[{"confidence":0.7,"from_step":"s001-44360e4e","relation":"produces","to_claim":null,"to_step":"s003-8e75c575"},{"confidence":0.8,"from_step":"s003-8e75c575","relation":"supports","to_claim":null,"to_step":"s004-1371809e"}],"steps":[{"cost_usd":null,"end_time":"2024-06-29T22:26:45Z","input_ref":"sha256:30e3d3b8486956f1cf8d44da9e322aee06dfa537b9f700d87aa8e0d2e6caec4f","kind":"agent","latency_ms":5000,"metadata":{"agent.name":"autogen-assistant","resource":{"service.name":"autogen","service.namespace":"atu-examples"},"source":"opentelemetry","source_kind":null,"task.goal":"Find two synthetic sources and summarize them","task_type":"research"},"name":"invoke_agent","output_ref":null,"parent_step_id":null,"span_id":"root001","start_time":"2024-06-29T22:26:40Z","status":"ok","step_id":"s001-44360e4e","tool_name":null},{"cost_usd":0.0012,"end_time":"2024-06-29T22:26:41Z","input_ref":null,"kind":"llm","latency_ms":1000,"metadata":{"cost_usd":0.0012,"gen_ai.request.model":"gpt-5-mini","gen_ai.system":"OpenAI","resource":{"service.name":"autogen","service.namespace":"atu-examples"},"source":"opentelemetry","source_kind":null},"name":"draft_search_plan","output_ref":"sha256:b816b527e2a4e0dc718e985bb74dea618cfc7777e3958ed116c6065466d13d07","parent_step_id":"s001-44360e4e","span_id":"llm001","start_time":"2024-06-29T22:26:40Z","status":"ok","step_id":"s002-08a4df07","tool_name":null},{"cost_usd":null,"end_time":"2024-06-29T22:26:42Z","input_ref":"sha256:87b2dce08c130c41c9e6ba8de499a8a19aec5ab467c75dc8f02d65864116ecf5","kind":"tool","latency_ms":800,"metadata":{"artifact_uri":"memory://synthetic/search/result","resource":{"service.name":"autogen","service.namespace":"atu-examples"},"source":"opentelemetry","source_kind":null,"tool.name":"synthetic_search"},"name":"synthetic_search","output_ref":"sha256:7a109d63e1e2be417650c46e20e48334ca42fdbe240fe83dad163d89a3292ac5","parent_step_id":"s001-44360e4e","span_id":"tool001","start_time":"2024-06-29T22:26:42Z","status":"ok","step_id":"s003-8e75c575","tool_name":"synthetic_search"},{"cost_usd":0.0025,"end_time":"2024-06-29T22:26:45Z","input_ref":null,"kind":"llm","latency_ms":2000,"metadata":{"cost_usd":0.0025,"gen_ai.request.model":"gpt-5-mini","gen_ai.system":"OpenAI","resource":{"service.name":"autogen","service.namespace":"atu-examples"},"source":"opentelemetry","source_kind":null},"name":"final_summary","output_ref":"sha256:ea60c1fda2a3738596ff5330f1a7d38cd2f667ee8d264871f3eefa8217bfc44c","parent_step_id":"s001-44360e4e","span_id":"llm002","start_time":"2024-06-29T22:26:43Z","status":"ok","step_id":"s004-1371809e","tool_name":null}],"tool_receipts":[{"idempotency_key":null,"input_digest":"sha256:87b2dce08c130c41c9e6ba8de499a8a19aec5ab467c75dc8f02d65864116ecf5","receipt_id":"r-c409b3da540ce8d85d","result_digest":"sha256:7a109d63e1e2be417650c46e20e48334ca42fdbe240fe83dad163d89a3292ac5","side_effect":false,"step_id":"s003-8e75c575","timestamp":"2024-06-29T22:26:42Z","tool_name":"synthetic_search","uri":"memory://synthetic/search/result"}]},"labels":{"cost_usd":0.0037,"failure_mode":null,"failure_origin_step":null,"latency_ms":5000,"policy_violation":false,"provenance_completeness":1.0,"quality_score":null,"redundancy_score":0.0,"replay_class":"semi_deterministic","success":true},"replay":{"class":"semi_deterministic","manifest_ref":"replay/manifests/atu-ep-b087508fbff90258d1.json","privacy_tier":"internal","redaction_policy":"standard"},"source_trace":{"framework":"autogen","project":"atu-examples","root_span_id":"root001","schema":"opentelemetry","thread_id":null,"trace_id":"autogen-trace-001"}}
