{"atu_version":"0.2.0","citation":{"dataset":null,"dataset_doi":null,"software_doi":null,"split":null},"episode":{"agent_profile":{"agent_name":null,"agent_role":null,"metadata":{},"persona":null},"episode_id":"atu-ep-ce99042cf3b5e9caec","parent_episode_id":null,"task_context":{"constraints":[],"goal":"Classify a synthetic trace","policy_context":{},"task_type":"agent_trace"}},"execution":{"evidence_edges":[],"steps":[{"cost_usd":null,"end_time":"2024-06-30T06:00:03Z","input_ref":"sha256:52d815ea2918eac45915dde9cb3ce2829d7b780d10b2ef77dfa0fb635e9aefd1","kind":"chain","latency_ms":3000,"metadata":{"metadata":{"task_type":"classification","thread_id":"thread-synthetic-001"},"project_name":"atu-examples","resource":{"service.name":"langsmith"},"run_type":"chain","source":"langsmith","source_kind":"chain"},"name":"research_chain","output_ref":"sha256:3a1d32fae837362303107ca21778efd0ecb141a9765087a6943d10f292f8c0aa","parent_step_id":null,"span_id":"11111111-1111-4111-8111-111111111111","start_time":"2024-06-30T06:00:00Z","status":"unset","step_id":"s001-6bde5b91","tool_name":null},{"cost_usd":null,"end_time":"2024-06-30T06:00:03Z","input_ref":"sha256:806e88cdbeae39b2b735c56189759b298d9b7dfc4f13a3c54ce2cff8caafb691","kind":"llm","latency_ms":2000,"metadata":{"metadata":{"model":"gpt-5-mini"},"project_name":"atu-examples","resource":{"service.name":"langsmith"},"run_type":"llm","source":"langsmith","source_kind":"llm"},"name":"classifier_llm","output_ref":"sha256:732b3f36ad5758514eabd801910e6a467357b039442f5c589a3f22baf810ac97","parent_step_id":"s001-6bde5b91","span_id":"22222222-2222-4222-8222-222222222222","start_time":"2024-06-30T06:00:01Z","status":"unset","step_id":"s002-a3bb0c67","tool_name":null}],"tool_receipts":[]},"labels":{"cost_usd":null,"failure_mode":null,"failure_origin_step":null,"latency_ms":3000,"policy_violation":false,"provenance_completeness":0.0,"quality_score":null,"redundancy_score":0.0,"replay_class":"semi_deterministic","success":true},"replay":{"class":"semi_deterministic","manifest_ref":"replay/manifests/atu-ep-ce99042cf3b5e9caec.json","privacy_tier":"internal","redaction_policy":"standard"},"source_trace":{"framework":"langsmith","project":"atu-examples","root_span_id":"11111111-1111-4111-8111-111111111111","schema":"langsmith","thread_id":null,"trace_id":"langsmith-trace-001"}}
