{"atu_version":"0.2.0","citation":{"dataset":null,"dataset_doi":null,"software_doi":null,"split":null},"episode":{"agent_profile":{"agent_name":"crew-writer","agent_role":null,"metadata":{},"persona":null},"episode_id":"atu-ep-8e279122f1c809bc16","parent_episode_id":null,"task_context":{"constraints":[],"goal":"Create a local synthetic note","policy_context":{},"task_type":"file_generation"}},"execution":{"evidence_edges":[{"confidence":0.7,"from_step":"s001-29dcda2d","relation":"produces","to_claim":null,"to_step":"s002-08b48c30"},{"confidence":0.8,"from_step":"s002-08b48c30","relation":"supports","to_claim":null,"to_step":"s003-f8945ef1"}],"steps":[{"cost_usd":null,"end_time":"2024-06-29T22:28:24Z","input_ref":"sha256:c321e0bc2ce2a977c06ca09ab96c0d9ecd4ee0a134857dcee2e46d7d8e26341b","kind":"agent","latency_ms":4000,"metadata":{"agent.name":"crew-writer","openinference.span.kind":"AGENT","resource":{"service.name":"crewai","service.namespace":"atu-examples"},"source":"openinference","source_kind":null,"task_type":"file_generation"},"name":"crew_task","output_ref":null,"parent_step_id":null,"span_id":"crewroot001","start_time":"2024-06-29T22:28:20Z","status":"ok","step_id":"s001-29dcda2d","tool_name":null},{"cost_usd":null,"end_time":"2024-06-29T22:28:22Z","input_ref":"sha256:97c3d0b6e876b73a5af58ceec71a7e3f4cc35421777a3c619b74e159aadded3d","kind":"tool","latency_ms":1500,"metadata":{"artifact_uri":"memory://synthetic/note.txt","openinference.span.kind":"TOOL","resource":{"service.name":"crewai","service.namespace":"atu-examples"},"side_effect":true,"source":"openinference","source_kind":null,"tool.name":"file_write"},"name":"write_synthetic_note","output_ref":"sha256:0dc3af13bd98cc202bdab3be1ee37e1927d77bc4f034808c86bb613c75dc359d","parent_step_id":"s001-29dcda2d","span_id":"crewtool001","start_time":"2024-06-29T22:28:21Z","status":"ok","step_id":"s002-08b48c30","tool_name":"file_write"},{"cost_usd":null,"end_time":"2024-06-29T22:28:24Z","input_ref":null,"kind":"llm","latency_ms":1500,"metadata":{"llm.model_name":"gpt-5-mini","llm.system":"OpenAI","openinference.span.kind":"LLM","resource":{"service.name":"crewai","service.namespace":"atu-examples"},"source":"openinference","source_kind":null},"name":"report_result","output_ref":"sha256:935e5363453cb8943676e289108d169044a361a74ba84bda4733d827d04bcb5f","parent_step_id":"s001-29dcda2d","span_id":"crewllm001","start_time":"2024-06-29T22:28:22Z","status":"ok","step_id":"s003-f8945ef1","tool_name":null}],"tool_receipts":[{"idempotency_key":null,"input_digest":"sha256:97c3d0b6e876b73a5af58ceec71a7e3f4cc35421777a3c619b74e159aadded3d","receipt_id":"r-a1895b7f2e4def05b5","result_digest":"sha256:0dc3af13bd98cc202bdab3be1ee37e1927d77bc4f034808c86bb613c75dc359d","side_effect":true,"step_id":"s002-08b48c30","timestamp":"2024-06-29T22:28:22Z","tool_name":"file_write","uri":"memory://synthetic/note.txt"}]},"labels":{"cost_usd":null,"failure_mode":null,"failure_origin_step":null,"latency_ms":4000,"policy_violation":false,"provenance_completeness":1.0,"quality_score":null,"redundancy_score":0.0,"replay_class":"receipt_only","success":true},"replay":{"class":"receipt_only","manifest_ref":"replay/manifests/atu-ep-8e279122f1c809bc16.json","privacy_tier":"internal","redaction_policy":"standard"},"source_trace":{"framework":"crewai","project":"atu-examples","root_span_id":"crewroot001","schema":"openinference","thread_id":null,"trace_id":"crewai-trace-001"}}
